tweet,retweetsCount,favoritesCount,timestamp
"RT @LisaCfuglesang: Skadlig syn på studier och krav http://t.co/lIRQGPoFAi via @SvD",2,0,Wed Dec 31 11:36:28 +0000 2014
"A human centrifuge would do great science on ISS &amp; help Astros stay healthy. But not cheap &amp; challenging http://t.co/3vZ0Joh8qM",4,4,Fri Dec 19 21:37:22 +0000 2014
"2 great days @MIT w Jeff Hoffman. Advice on Aerspace teaching and research. Here w skin suit for future EVA http://t.co/hNdIZGoT3x",3,4,Fri Dec 19 21:32:17 +0000 2014
"RT @rymdkanalen: Idag tipsar vår egen astronaut @CFuglesang om två underhållande #julklappar. Se hans film här: http://t.co/Leb0FdfI5o http…",3,0,Fri Dec 19 21:17:06 +0000 2014
"Tänk om Riksdagen skulle göra som US Congress och ge mer pengar till rymdprogrammen än verkställande organ begär! http://t.co/4qEAYQ6YIF",7,7,Wed Dec 17 13:36:35 +0000 2014
"Heading to Boston &amp; MIT, for a study visit. But flight delayed  - hope connecting flight also delayed, though a night on Iceland not too bad",0,1,Wed Dec 17 13:29:41 +0000 2014
"RT @Landshovding: Rymden inspirerar! 5E i Ljungby - en av många klasser i Småland som påbörjat kunskapsresan  #motnyahöjder http://t.co/HyX…",4,0,Tue Dec 16 19:55:53 +0000 2014
"RT @MaxCRoser: The break down of the Berlin wall was a turning point of history. Since then #Democracies outnumber Autocracies. http://t.co…",89,0,Tue Dec 16 19:53:31 +0000 2014
"SSF styremöte igår. Gav bidrag till mkt bra akademi-industri forskprojekt. Och SSF fick högt betyg av utvärdering: http://t.co/ANTR3LCgG7",1,1,Tue Dec 16 11:32:24 +0000 2014
"Fick en 'tjuvtitt' av 'Micke&amp;Vetonica' följt av party på Mr French. Mysigt bra film! Tack till @Mbindefeld för en schysst kväll!",1,0,Sun Dec 14 21:22:22 +0000 2014
"RT @AnoushehAnsari: Very insightful! How Different Cultures Understand Time http://t.co/bQIN44jYOq",6,0,Sat Dec 13 22:47:07 +0000 2014
"Kommer 20 min tidigt till Luciakonsert i Oscarskyrkan - och det är nästan fullt redan! Måste vara lovande",0,2,Sat Dec 13 16:46:18 +0000 2014
"Iconic images of #space, no.12: Curbeam &amp; @CFuglesang spacewalk over NZ, STS-116, 12/12/06 @NASAhistory http://t.co/AAHO73ojGF My favorite😊",57,88,Sat Dec 13 16:29:43 +0000 2014
"På tåget till Sundsvall, där jag ska prata för studenterna på Mittuniversitetet i em.",2,5,Fri Dec 12 07:49:23 +0000 2014
"Gave a seminar at AlbaNova/KTH today on ISS Science and particularly JEM-EUSO. On video http://t.co/kpeVYeovJd",2,4,Thu Dec 11 20:04:21 +0000 2014
"RT @rymdkanalen: Imorgon kl 17 signerar Börje Lundberg författare av 'Svenska rymdäventyr' och @CFuglesang böcker i TNFs bokhandel på Öster…",2,0,Wed Dec 10 21:07:18 +0000 2014
"Skriver om hur viktigt det är med bra lärare och att de måste få stöd av alla delar i samhället: http://t.co/ZlNsofEi5p",3,1,Wed Dec 10 11:11:36 +0000 2014
"#AsteroidDay is a global movement to protect our planet. Follow @asteroidday and visit http://t.co/cruvdFsuWU Join and leran more!",4,3,Thu Dec 04 16:13:36 +0000 2014
"Ett jättestort tekn forskcenter, SkolTech, byggs i Moskva. Också utbildn. 2 svenska Mars arb där med uppbyggandet http://t.co/y1buSnY6u9",0,2,Tue Dec 02 16:17:41 +0000 2014
"In Moscow this week, for JEM-EUSO meetings. Studying the ultra-high energy cosmic ray with a on experiment on ISS.",0,1,Mon Dec 01 17:46:08 +0000 2014
"7 payloads selected for MIST, KTH’s student satellite: https://t.co/fBYXlS4plq There might be even more later, e.g. a special camera",3,4,Sun Nov 30 09:29:27 +0000 2014
"On my way to ESTEC, for a day. Mtgs for payloads on KTH's studentsatellite MIST main reason. Will be fun to come back for a short visit also",4,5,Wed Nov 26 08:51:49 +0000 2014
"RT @markp8183: Felix Ryde, KTH, om gamma utbrott i universum - AlbaNova öppen föreläsning. http://t.co/4ula0W2uFq",1,0,Mon Nov 24 17:03:51 +0000 2014
"Högtidlig promotion &amp; installation för KTH i Konserthuset. Först ut jubeldoktor Lars Ingelstam. 50 år som Tekn.Dr. http://t.co/RTeI3vd92q",0,1,Fri Nov 21 15:29:37 +0000 2014
"Idag är jag extra stolt far:-) http://t.co/RYWpqkI0zB",1,21,Fri Nov 21 09:19:02 +0000 2014
"@markp8183 Kul! Måste hittat dit på lustiga vägar - fast knappast via rymden:-)",0,0,Wed Nov 19 16:51:25 +0000 2014
"Study in Sweden. Event in HoChiMin City supported by Vietnamese astro Pham Tuan Swedens ambassador, me &amp; the Dalahäst http://t.co/txSIsUeqPl",5,7,Sat Nov 15 05:18:25 +0000 2014
"I Vietnam för Innovative Sweden.",2,2,Fri Nov 14 13:20:58 +0000 2014
"Why does EC scrap the Scientific Advisor role? Afraid science facts go against political wish-thinking? I’m worried http://t.co/wPH3lIDVYm",2,4,Thu Nov 13 16:03:02 +0000 2014
"Relevans i skolan, industrikontakter, verklighetsanknytning, matte 'coolt' ämne, påverka tidigt - några bra tankar på IVA #ingengörshjältar",5,5,Thu Nov 13 07:25:55 +0000 2014
"Frukostsemimarium #ingenjörshjältar. Fler måste ta examen! Föräldrar, spec mammor, som blivit ingenjör, bra förebild http://t.co/13JPFfhAY1",6,6,Thu Nov 13 07:10:52 +0000 2014
"Touch Down! På en komet en halv miljarder km bort!!! DET är häftigt! Vilken framgång för Rosetta, ESA och Europeisk rymdforskning &amp;-teknik.",83,68,Wed Nov 12 16:11:17 +0000 2014
"RT @rymdkanalen: Kameran OSIRIS ombord på Rosetta har tagit den här bilden av Philae på sin väg ner mot kometen! Cool! #rosetta http://t.co…",10,0,Wed Nov 12 15:46:53 +0000 2014
"RT @esa: Cheers in main control room as @Philae2014 separation confirmed #cometlanding https://t.co/bEK6WZ9psB",279,0,Wed Nov 12 09:43:43 +0000 2014
"Spännande Rymddag idag. Rosettalandaren Philae bör nu vara på väg ner mot kometen. Långsam nerfärd - 7 timmar",8,9,Wed Nov 12 09:01:02 +0000 2014
"@tekniskamuseet styrelse ringer digital fågel på #digitalrevolution före mötet http://t.co/Phs8Rcp9nQ",0,1,Tue Nov 11 12:31:19 +0000 2014
"RT @Landshovding: Nu rullar projektet där vi siktar mot #nyamöjder  http://t.co/PDmwb8TZRF",3,0,Wed Nov 05 00:12:10 +0000 2014
"NASA har nu en webb-sida på Svenska! http://t.co/Rs5aMrSi62 Marsbilder. Se oxå http://t.co/hyBV9QWRgE Läs mer: http://t.co/DnC32FhGGM",6,5,Mon Nov 03 13:01:36 +0000 2014
"RT @ISS_Research: Today marks 14 years of continuous human presence aboard @Space_Station! @NASA @esa @JAXA_en @csa_asc @fka_roscosmos http…",1374,0,Sun Nov 02 14:56:04 +0000 2014
"Tre ex: från regering, sångacener och rymden; på halloween fest i Värmland, hos Petre http://t.co/31bfLy39dl",5,6,Sat Nov 01 22:08:06 +0000 2014
"I share the pain with all involved in today's tragic Virgin Galactic accident, in particular the families. It's hard - but don't give up!",14,14,Fri Oct 31 23:03:09 +0000 2014
"Tragisk olycka Virgin Galactics rymdflygplan idag. Minst en pilot död. Lider med inblandade. Det är svårt  nå rymden! http://t.co/SRceuwvY17",5,5,Fri Oct 31 22:42:04 +0000 2014
"Gudmor Kristina, Fadder Christer med Jonte &amp; bror Christian på Jontefondsjakten. http://t.co/SqG4GMAkLc http://t.co/mZpiZchfFF",3,4,Fri Oct 31 12:36:13 +0000 2014
"Roligt att Ny Teknik uppmärksammar vår MIST-satellit. http://t.co/DrtP7AExmV NT är f.ö. en av de tidningar jag läser mest.",5,3,Thu Oct 30 07:53:23 +0000 2014
"Forskningsfinansiärer firar 20 år #mistrassfkk20. Seminarium och diskussioner på Moderna museet http://t.co/wH9VMOdmIQ",1,0,Wed Oct 29 13:09:13 +0000 2014
"Tråkig raketmiss i natt när Antares exploderade med Cygnus som skulle till ISS med last. Tur den var obemannad! https://t.co/rY49Iatjws",7,3,Wed Oct 29 12:11:16 +0000 2014
"MIST - namnet på KTHs studentsatellit efter webb-omröstningen.  http://t.co/yhapknIXvy  Grattis Josef, Christina, Stefan &amp; Natala Ivchenko!",1,2,Tue Oct 28 08:13:14 +0000 2014
"Roligt o bra #sciencecityväxjö igår, med raketuppskjutning #motnyahöjder! Nästa år har jag 100 kollegor med mig http://t.co/9o7efSvlJM",12,13,Sun Oct 26 18:49:15 +0000 2014
"RT @OlleNorberg: I recommend looking at the 'Space Economy at a Glance 2014' online edition http://t.co/CcREQb1sb2",2,0,Thu Oct 23 23:12:14 +0000 2014
"RT @TheLocalSweden: Astronaut helps launch first student satellite http://t.co/WYY8qD3nWU",8,0,Thu Oct 23 11:14:24 +0000 2014
"#DigitalRevolution, superhäftig utställning på @Tekniskamuseet öppnar på lördag http://t.co/9dehHFQsPs",10,7,Thu Oct 23 08:02:34 +0000 2014
"Dödsdansen premiär på Maxim. Underhållande, intressant. Vilka människotyper Strindberg beskriver! http://t.co/NttyihtWPt",1,1,Wed Oct 22 20:30:14 +0000 2014
"RT @maltesk: 'One day you may tax it' - alla gillar @markp8183:s citat från Faraday - om el - som argument för grundforskning. http://t.co/…",3,0,Tue Oct 21 13:51:26 +0000 2014
"Om KTHs studentsatellit på KTHs webb: http://t.co/Nnp507AqDK  Några dagar kvar att rösta på namn. Alla kan vara med! http://t.co/yhapknIXvy",4,2,Tue Oct 21 13:49:49 +0000 2014
"Mark Pearce, KTH, presenterar &amp; reflekterar astrofysik för nationella rymdutredn på Rymdforums rymdforskseminarium. http://t.co/8WvIK2KfMg",3,2,Tue Oct 21 13:16:57 +0000 2014
"SSC presenting exciting future plans for ESRANGE @ #SpaceUpSweden. . Launching small satellites for example http://t.co/zakFDdk2xa",5,8,Sat Oct 18 12:00:15 +0000 2014
"Gathering for the mandatory group photo at #SpaceUpSweden http://t.co/dTv5UEZUU5",5,12,Sat Oct 18 10:25:38 +0000 2014
"Thomas Karlsson, OHB Sweden #SpaceUpSweden Formation flying sat:s - can they help solve space debris prob? Maybe. http://t.co/sM7Gxcty3H",1,0,Sat Oct 18 10:13:06 +0000 2014
"Mr Space Sven Grahn at #SpaceUpSweden on perspectives of Space flight history http://t.co/lXnV0Td39j",4,6,Sat Oct 18 09:39:39 +0000 2014
"Gunilla Backman &amp; Fred Johansson glada efter suverän show 'Från Cats till Mamma Mia' i Berwaldhallen i kväll http://t.co/1cF3R2tK1o",1,2,Fri Oct 17 22:07:01 +0000 2014
"I morgon SpaceUp på KTH, AlbaNova http://t.co/pqV70iwhwS  Del av Astronomins Dag&amp;Natt http://t.co/pqV70iwhwS Jag 1st ut kl 10, sedan RS:s GD",0,3,Fri Oct 17 12:50:55 +0000 2014
"Mastermässa på KTH. Nu min tur att presentera AeroSpace-programmet",1,1,Thu Oct 16 15:40:01 +0000 2014
"Talking about Extreme Environments... http://t.co/5QvnmcbQ7f",1,2,Thu Oct 16 13:30:03 +0000 2014
"Bill Atwood, Univ of California, presents this year's Manne Siegbahn Lecture 'Exploring the gamma ray universe' on the Fermi space telescope",2,0,Thu Oct 16 13:23:36 +0000 2014
"Årets miljöhjältar Henrik Persson, Anna Elmqvist och Gunhild Stordalen får sina diplom av Kungen http://t.co/PSrIXuiVbm",8,9,Thu Oct 16 11:04:24 +0000 2014
"Världsnaturfonden WWFs förtroenderådsmöt öppnas. Jihde pris, Pandabok och Årtets Miljöhjältar på agendan. http://t.co/TItagQwamv",0,2,Thu Oct 16 08:04:31 +0000 2014
"RT @Arenholm: @CFuglesang med formgivare @tinterova o den speciellt framtagna gåvan @halsingebocken från @Nordanstigs @rymdkanalen http://t…",4,0,Fri Oct 10 12:47:53 +0000 2014
"Östra skolan i Hudik bjöd på strålande raketavslut till en rolig, inspirerande och givande slolturnevecka http://t.co/34RUvqHn3p",1,3,Fri Oct 10 12:35:50 +0000 2014
"Vilket varmt välkomnande till Bergsjö skola i Nordanstig kommun! Och en skiftnyckel man inte tappar i 1:a taget!:-) http://t.co/nwQL34Z8za",4,8,Fri Oct 10 09:36:58 +0000 2014
"Rösta på namn till KTHs studentsatellit! Välj bland 7 finalister. Alla är välkomna att delta.  http://t.co/TUfqNkEuhz",11,1,Fri Oct 10 06:16:48 +0000 2014
"I Delsbo hade 5 skolor samlats i idrottshall. Sen det oblig. gruppfotot med 8e-klasserna. Framför planetsystemstavlor http://t.co/0pop2n6MqF",1,3,Thu Oct 09 13:37:30 +0000 2014
"Kilaforsskolan, första i Hälsingland. T.o.m. flera medier på plats, men elevernas frågor var roligare:-)",2,2,Thu Oct 09 10:39:35 +0000 2014
"Perslundaskolan i Ockelbo var den sista i Gästrikland. Hela skolan samlad i bion Gotan. Hälsingland nästa; Bollnäs i natt.",2,2,Wed Oct 08 12:44:10 +0000 2014
"Skolan Prosperitas i Järbo: jag fick den här fina gips-modellen av 'min' rymdfärja Discovery http://t.co/xRHHjQPp7P",3,4,Wed Oct 08 09:30:50 +0000 2014
"På Engelska skolan i Gävle var alla presentationer på engelska. Både min och elevernas. Excellent, indeed!",5,4,Tue Oct 07 14:20:10 +0000 2014
"RT @rymdkanalen: Idag genomför 2 astronauter en #rymdpromenad på ISS. Se det live från klockan 14.10! http://t.co/al2lifywQ6 #rymden http:/…",6,0,Tue Oct 07 09:32:05 +0000 2014
"Hedängskolan, Storvik: skalenlig modell av solsystemet. Solen där bak och jorden på pinne framför oss. http://t.co/mTTiRXBpds",10,17,Tue Oct 07 09:10:46 +0000 2014
"Are you an engineering student in India?! Want to study at KTH in Sweden? Take this challenge and you could make it! http://t.co/sY8Cifh0c4",2,3,Mon Oct 06 14:49:09 +0000 2014
"Solängsskolan bjöd på eget TV-prog 'Space place Talk show' och spännande Rymdvägg med korta prat om solsystemet. http://t.co/eVSg7sQp09",6,9,Mon Oct 06 14:11:55 +0000 2014
"Stigslunds skola: Byggt Marsbasmodell och duktiga på att svara på mina knepiga frågor http://t.co/xEymXZWX10",21,22,Mon Oct 06 09:05:13 +0000 2014
"Gävle! Här och nu börjar höstens skolturne.",15,11,Mon Oct 06 06:55:05 +0000 2014
"'50'-årig landshövding firas som sig bör av goda vänner:-) http://t.co/wW19VqUhmk",0,1,Sat Oct 04 21:19:28 +0000 2014
"Årets Alumn gav utmärkt föreläsn om varför fler ingenjörer behövs i politiken. Tack, Regina Kevius, L-99!! http://t.co/STPSAMmiw9",8,21,Sat Oct 04 16:51:57 +0000 2014
"KTHs Alumni-vecka avslutas med Öppet Hus idag. Jag visar vad en del vad KTH Rymdcentret gör i Alfvenlabbet.",2,2,Sat Oct 04 06:08:47 +0000 2014
"RT @carlbildt: Well worth reading. Is Russia heading for political chaos? http://t.co/VmF4s9a1HZ",98,0,Fri Oct 03 20:56:10 +0000 2014
"Nästa vecka skolturne igen. 11 skolor i Gästrikland &amp; Hälsingland. Ser fram emot det. Alltid roligt att prata för elever!",1,9,Thu Oct 02 20:05:29 +0000 2014
"Om 1 år Astronautkongress ”Inspired by Space” i Sverige. Min rapport om årets dito: Länk fr KTH Rymdcenters webbsida http://t.co/28eIYdAYPR",5,5,Sat Sep 27 07:46:49 +0000 2014
"RT @Landshovding: 'Inspired by space' är temat för ASE o stämmer väl med vår satsning som är mycket mer än konferensen #motnyahöjder http:/…",4,0,Sat Sep 27 06:14:43 +0000 2014
"Årets Alfvenföreläsn.: Magnetosfärmätningar med satellitkonstellation. Må 29/9 kl 13 i E1 på KTH http://t.co/VGUlDqjVHS. Med KTH Rymdcenter",0,3,Fri Sep 26 05:39:13 +0000 2014
"Alla kan förslå namn på KTH studentsatellit! Vinst: lunch med projektledaren Sven Grahn (Mr Space i Sverige) &amp; mig. http://t.co/RRrS4VR2fZ",9,3,Fri Sep 26 05:22:45 +0000 2014
"KTH-student!? Vill du vara med och bygga satellit?! Några dagar kvar till deadline 30/9 att anmäla intresse: http://t.co/RRrS4VR2fZ",3,2,Fri Sep 26 05:19:12 +0000 2014
"The 1st space walkers of China &amp; Sweden doing the 'Community Day' outreach together http://t.co/ILE8zTvRcH",7,8,Sun Sep 21 17:41:25 +0000 2014
"We got a tour at China's astronaut center. Nice facilities. Here the cylindrical pool for EVA training http://t.co/PBfAycW4qq",5,3,Sun Sep 21 17:36:54 +0000 2014
"The Chinese we met were friendly, but it’s absolutely unacceptable that China officials cut off Twitter, Facebook, Google….",2,6,Sun Sep 21 17:30:06 +0000 2014
"Back fr China and Association of Space Explorers’ 27th Planetary Congress. Well done by Liwei and his team, with 91 participating astronauts",4,1,Sun Sep 21 17:26:25 +0000 2014
"Watch video on how an ISS tech demo experiment saved a sailors life http://t.co/mKiFNl3pzP and more on ISS benefits http://t.co/z20CrP8vBC",2,4,Mon Sep 08 19:23:22 +0000 2014
"Indian students are very interested in space. Even at Guwahati airport several came and asked me questions - and a few selfies:-)",2,5,Mon Sep 08 19:10:42 +0000 2014
"Promoting space, KTH &amp; Sweden at #Techniche, IIT Guwahati. Enthusiastic crowds, fun quiz about Sweden for smart students, media interest",7,6,Sat Sep 06 17:32:22 +0000 2014
"RT @maltesk: Nu kan du regga dig för #SpaceUpSweden med bla @CFuglesang på #Astronominsdag den 18 okt: http://t.co/rIzcWENo2x",2,0,Thu Sep 04 14:55:50 +0000 2014
"RT @Landshovding: Länets skolledare på #residenset om hur vi tar samarbetet skola/näringsliv #motnyahöjder med hjälp av astronautkonferense…",2,0,Wed Sep 03 16:09:46 +0000 2014
"Don’t miss Sven Grahn talk Cubesats Thu 4/9 17:00 in E3 at KTH. No one beats Sven in space knowledge and enthusiasm! http://t.co/5Ap70pMe7s",1,0,Tue Sep 02 10:49:00 +0000 2014
"@JHNfu @AusAndgie7 @maltesk @starlingLX @SpaceUpEU @SpaceUpConf A SpaceUp to be 18/10 in Stockholm at KTH, venue: Alba Nova. I’ll be there",2,3,Tue Sep 02 01:53:59 +0000 2014
"RT @gunderhaegg: Don't miss the lectures... http://t.co/INC7CQaepu",2,0,Tue Sep 02 01:48:12 +0000 2014
"Spelade in 'Helt sant' häromdagen. Sänds 14/9 kl 10:33 på SR P4. Men glöm inte att rösta också:-) http://t.co/UuAGjNiXOG",2,6,Mon Sep 01 16:25:12 +0000 2014
"KTH Läsår-start idag. Önskar alla nya &amp; gamla studenter ett roligt &amp; lärorikt år! Nyfiken på KTHs rymdverksamhet? Se: http://t.co/5ALKgZjiTp",5,2,Mon Sep 01 06:06:54 +0000 2014
"RT @annlid: Great to see out paper referenced! Urgent calls to close the gap between research and teaching -  http://t.co/Tt648tUivJ @vinno…",5,0,Fri Aug 29 16:17:05 +0000 2014
"5 yr ago - a perfect launch to a great mission. Thanks to all who supported STS128 at the time. We all enjoyed it! http://t.co/RWvLnSrObX",12,9,Fri Aug 29 12:19:38 +0000 2014
"@SixtenEngstrom @Landshovding @MyCuff Man tackar för de snygga personliga manschettknapparna!  Kommer att komma till god användning:-)",7,5,Wed Aug 27 04:15:22 +0000 2014
"Inaugurated Boliden's Garpenberg mine w/ CEO Lennart Evrell. And lifted gold. In 0g it'd be easier:-) http://t.co/zNG9UqtYxe",2,1,Tue Aug 26 15:33:16 +0000 2014
"Problem &amp; lösningar från mitt Mattepotpurri finns nu på KTH Rymdcenters sida http://t.co/yhapknIXvy Tack alla i fredags som fyllde hela F1!",0,1,Tue Aug 26 05:41:40 +0000 2014
"Och nu blir det mattepotpurri för intresserade 0:an i F1 på KTH. Rymd &amp; roliga problem.",3,2,Fri Aug 22 09:01:49 +0000 2014
"Scandinavian Physiology Society. I'm a physicist giving the first speech:-) About physiology in space, of course http://t.co/HxE3WyW3Bp",1,2,Fri Aug 22 07:01:49 +0000 2014
"The goal is to send people on short space trips from Northern Sweden in a few years. Tourists, scientists, artists,...",9,7,Thu Aug 21 16:42:39 +0000 2014
"Space Travel Alliance launch!",6,4,Thu Aug 21 16:39:05 +0000 2014
"0:an är här på KTH! Roliga tider börjar. Jag gör ett kort inhopp och pratar om Rymd på KTH för Samhällsbyggarna",3,5,Mon Aug 18 08:44:43 +0000 2014
"Fri Tanke har specialerbjudande på alla mina barnböcker inför skolstarten: http://t.co/xe1OIvO8fc",1,2,Fri Aug 15 20:29:22 +0000 2014
"RT @Landshovding: Snart hälsar vi Rymdstyrelsens ledning välkommen - om 1 år landar 100 astronauter i Småland. Det ska vi dra nytta av - fö…",8,0,Wed Aug 13 19:16:56 +0000 2014
"RT @maltesk: @SpaceUpEU RTen @maltesk: Sweden's first #SpaceUp planned for 18 Oct at KTH in Stockholm supported by @CFuglesang:  http://t.c…",4,0,Wed Aug 13 19:14:41 +0000 2014
"@Poptart Nej, man får inte lock för öronen vid raketuppskjutning. Lufttrycket är detsamma i raketen som på jorden hela tiden.",0,1,Sat Aug 09 07:41:05 +0000 2014
"Today ISS has had crew 5000 d:s. I followed the 1st crew’s trip there fr TsUP. Amazingly much has happened since. For science, tech &amp; peace",5,8,Sat Jul 12 11:39:29 +0000 2014
"Should one be scared, angry or sad, when elected politicians says things like this about the climate question http://t.co/dWmcCO4EaO",11,0,Thu Jul 10 20:44:55 +0000 2014
"RT @SverigesRadioP3: Rymdmannen @CFuglesang (min idol typ) är med i #hallåp3 idag (NU). Ställ en fråga med taggen! Eller skriv här: http://…",5,0,Tue Jul 08 08:18:06 +0000 2014
"On the island Ven Tycho Brahe made his meas'ts, leading to the modern view of solar system. A great museum today here http://t.co/nQ8wqW14Ko",5,10,Sun Jul 06 10:47:06 +0000 2014
"Landskrona. Inviger konstutställningen 'International d'Art Naïf' kl 14. Undrar hur en naivist skulle illustrera jorden från ovan?!",3,1,Sat Jul 05 09:47:02 +0000 2014
"Bye #Almedalen! Wonderful pot of ideas and discussion - exchanges that drive and improve society forward. This is DEMOCRACY!",4,5,Fri Jul 04 09:04:57 +0000 2014
"TV 'Godmorgon Almedalen' om 5 min. Ska pratas om sociala medel och hur/varför använda bl.a. Twitter",1,3,Fri Jul 04 05:03:10 +0000 2014
"Radiointervju om bristen på ingenjörer och om KTHs studentsatellit - på ryska! Hoppas det blev förståeligt:-)",1,0,Thu Jul 03 11:50:18 +0000 2014
"Varför så låg genomströmn för ing.-utb? En anledning: för lätt få jobb innan helt klar. Men en del klara ej. Förkunskapsnivån måste höjas",1,1,Thu Jul 03 10:59:32 +0000 2014
"#Almedalen: 'Hur löser vi Sveriges ingenjörsbrist?' Är det brist i antal, el utbildn., el hur de utnyttjas på arbetsmarknaden?",0,1,Thu Jul 03 10:51:24 +0000 2014
"RT @TeachforSweden: @CFuglesang och Peter Larsson @Ingenjorerna har skrivit under för likvärdig skola i #Almedalen http://t.co/Bu6dTrCYe6",3,0,Wed Jul 02 21:48:21 +0000 2014
"Snart Stålbrallan, prisutdelning, arbetsmiljö, rymdteknologi. http://t.co/V6IRVHBUfp",3,0,Wed Jul 02 16:42:27 +0000 2014
"Unga ställer fantastiska frågor! Några ska jag försöka besvara när Svenska Science Centers diskuterar framtid kl 16:15 idag på Fenomenalen",6,3,Wed Jul 02 08:25:47 +0000 2014
"För att förtydliga: ville inte alls gå förbi kön vid Surfers. Men ngn (förstod sen Malou v S) bilen insläppt &amp; då frågade jag om kötid!",4,5,Tue Jul 01 21:54:14 +0000 2014
"Surfers, i Visby. Det värsta jag råkat ut för. Är helt nykter men blir portad för är 'för onykter'. Bara för att ha frågat om väntetid !!",166,73,Tue Jul 01 21:21:05 +0000 2014
"RT @AnnFollin: Imorgon 2/7 sitter @CFuglesang , Skolverkets @Anna_Ekstrom + statssekr Bertil Östberg mfl i Heta Stolen Fenomenalen 16:15 /1…",4,0,Tue Jul 01 17:17:08 +0000 2014
"#Almedalen 11-13 ”Hur säkra återväxten av naturvetare &amp; tekniker” Några politiker &amp; forskare (&amp; jag) diskuterar. MAX-lab org. S:t Hansg. 18",2,1,Tue Jul 01 08:10:22 +0000 2014
"Zakaria: Brilliant on econom&amp;political world history; why we should be optimistic. Sweden has good system, do incremental changes to keep up",8,2,Mon Jun 30 08:58:39 +0000 2014
"Fareed Zakaria in #almedalen While in US i read many good articles by him. http://t.co/58I80dyTgi",5,1,Mon Jun 30 08:12:03 +0000 2014
